{
  "schema_version": "0.5.0",
  "case_ref": "CASE-0001",
  "revision_id": "REVISION-0001",
  "origin_ref": "MODEL:origin-alpha:v1",
  "derivative_ref": "MODEL:student-beta:v1",
  "prior_assessment_ref": "ASSESSMENT-0001",
  "revised_assessment_ref": "ASSESSMENT-0002",
  "revision_trigger": "reproduction",
  "trigger_refs": [
    "REPRODUCTION-0001"
  ],
  "challenge_refs": [
    "CHALLENGE-0001"
  ],
  "reproduction_refs": [
    "REPRODUCTION-0001"
  ],
  "evidence_added_refs": [
    "EVIDENCE-0005"
  ],
  "evidence_removed_refs": [],
  "fusion_refs": [
    "FUSION-0002"
  ],
  "revision_basis": [
    "REPRODUCTION-0001 did not reproduce the watermark result",
    "EVIDENCE-0005 was introduced as material counter-evidence",
    "FUSION-0002 produced a conflicted result"
  ],
  "change_summary": [
    "assessment state changed from supported to disputed",
    "confidence changed from 0.86 to 0.58",
    "ASSESSMENT-0001 remains preserved"
  ],
  "revision_state": "applied",
  "created_by": "AUDITOR:revision-controller",
  "created_at": "2026-09-07T01:45:00Z",
  "effective_at": "2026-09-07T01:50:00Z",
  "resolution_note": "The revised assessment was applied without deleting the prior assessment."
}
